{"@context":["https://www.w3.org/ns/did/v1","https://w3id.org/security/suites/jws-2020/v1","https://worldhealthorganization.github.io/smart-trust/tng-additional-context/v1"],"id":"did:web:tng-cdn-dev.who.int:v2:trustlist:-:XL:SCA","controller":"did:web:tng-cdn-dev.who.int:v2:trustlist:-:XL","verificationMethod":[{"id":"did:web:tng-cdn-dev.who.int:v2:trustlist:-:XL:SCA#2RIYRNJvPBg=","type":"JsonWebKey2020","controller":"did:web:tng-cdn-dev.who.int:v2:trustlist:-:XL","publicKeyJwk":{"kty":"EC","kid":"2RIYRNJvPBg=","x5c":["MIICFTCCAbugAwIBAgIUN2LeFtoIJ9RnfWbtm2KmavrqVH8wCgYIKoZIzj0EAwIwZzELMAkGA1UEBhMCWEwxCzAJBgNVBAgMAk1UMREwDwYDVQQHDAhTQU5USUFHTzEPMA0GA1UECgwGQ1JFQVRFMQwwCgYDVQQLDANSJkQxGTAXBgNVBAMMEE5hdGlvblhMX1ROUF9TQ0EwHhcNMjMwOTI4MTczMDU0WhcNMjcwOTI4MTczMDU0WjBnMQswCQYDVQQGEwJYTDELMAkGA1UECAwCTVQxETAPBgNVBAcMCFNBTlRJQUdPMQ8wDQYDVQQKDAZDUkVBVEUxDDAKBgNVBAsMA1ImRDEZMBcGA1UEAwwQTmF0aW9uWExfVE5QX1NDQTBZMBMGByqGSM49AgEGCCqGSM49AwEHA0IABADa29gT9IMfh6XgAjNUFA/ckQEpjkHFCm3rAK47gNZ2nNIqutk15wILxLT3Zf6aMNwPcEn38iFaJaqKSQr663+jRTBDMBIGA1UdEwEB/wQIMAYBAf8CAQAwDgYDVR0PAQH/BAQDAgEGMB0GA1UdDgQWBBQOLQgcF/crtl6LuK9tYr650XygFjAKBggqhkjOPQQDAgNIADBFAiEAj2JHlg2ds+N5GRum3X1p6wUDppwUJjqtJRS/xxzU0fYCIFb56xpwL/nVQ+2/xyOlN9aVS+Gbq8u5+r1HePKGeMEJ"],"crv":"P-256","x":"ANrb2BP0gx-HpeACM1QUD9yRASmOQcUKbesArjuA1nY","y":"AJzSKrrZNecCC8S092X-mjDcD3BJ9_IhWiWqikkK-ut_"},"domain":"DCC","participant":"XL","keyusage":"SCA"},{"id":"did:web:tng-cdn-dev.who.int:v2:trustlist:-:XL:SCA#3wiKBCaFuok=","type":"JsonWebKey2020","controller":"did:web:tng-cdn-dev.who.int:v2:trustlist:-:XL","publicKeyJwk":{"kty":"EC","kid":"3wiKBCaFuok=","x5c":["MIICFTCCAbugAwIBAgIUZg3GCdgTYDbAORHyethAud82ETAwCgYIKoZIzj0EAwIwZzELMAkGA1UEBhMCWEwxCzAJBgNVBAgMAk1UMREwDwYDVQQHDAhTQU5USUFHTzEPMA0GA1UECgwGQ1JFQVRFMQwwCgYDVQQLDANSJkQxGTAXBgNVBAMMEE5hdGlvblhMX1ROUF9TQ0EwHhcNMjMxMDA0MTUyMTI3WhcNMjcxMDA0MTUyMTI3WjBnMQswCQYDVQQGEwJYTDELMAkGA1UECAwCTVQxETAPBgNVBAcMCFNBTlRJQUdPMQ8wDQYDVQQKDAZDUkVBVEUxDDAKBgNVBAsMA1ImRDEZMBcGA1UEAwwQTmF0aW9uWExfVE5QX1NDQTBZMBMGByqGSM49AgEGCCqGSM49AwEHA0IABOUht3wSLNl4Ae1/wRUfVY1CTKrOog+vuIyrIUOdCcIumeAz8AckJdfVTN5+sVcGkw1T8kQFMNaf5lCv8QH6jXWjRTBDMBIGA1UdEwEB/wQIMAYBAf8CAQAwDgYDVR0PAQH/BAQDAgEGMB0GA1UdDgQWBBQmHPdh8sTGTj8CpqhvKV/RXTwIujAKBggqhkjOPQQDAgNIADBFAiAOsxW3y3KitIQUu3NnKVL79Hc4wuAESSfDN2H6NGtCxQIhAKAmub3n49gFLDFcpc4rOX9GgUGvf5XEbzuXtMADgsll"],"crv":"P-256","x":"AOUht3wSLNl4Ae1_wRUfVY1CTKrOog-vuIyrIUOdCcIu","y":"AJngM_AHJCXX1UzefrFXBpMNU_JEBTDWn-ZQr_EB-o11"},"domain":"RACSEL-DDVC","participant":"XL","keyusage":"SCA"},{"id":"did:web:tng-cdn-dev.who.int:v2:trustlist:-:XL:SCA#8nAX0I7m7A0=","type":"JsonWebKey2020","controller":"did:web:tng-cdn-dev.who.int:v2:trustlist:-:XL","publicKeyJwk":{"kty":"EC","kid":"8nAX0I7m7A0=","x5c":["MIICDDCCAbOgAwIBAgIUWizt1UMJI5R+p7d99hVV+HCbLAUwCgYIKoZIzj0EAwIwYzELMAkGA1UEBhMCWEwxCzAJBgNVBAgMAk1UMREwDwYDVQQHDAhTYW50aWFnbzEQMA4GA1UECgwHTEFDUGFzczEQMA4GA1UECwwHTEFDUGFzczEQMA4GA1UEAwwHTEFDUGFzczAeFw0yMzA5MDUxMjI5NTNaFw0yNzA5MDUxMjI5NTNaMGMxCzAJBgNVBAYTAlhMMQswCQYDVQQIDAJNVDERMA8GA1UEBwwIU2FudGlhZ28xEDAOBgNVBAoMB0xBQ1Bhc3MxEDAOBgNVBAsMB0xBQ1Bhc3MxEDAOBgNVBAMMB0xBQ1Bhc3MwWTATBgcqhkjOPQIBBggqhkjOPQMBBwNCAAS6oX06i1IFeRR/G2yUtVWFxaknWsZBFGh7rsEiYzRYKh4Q4+kWbXTNdlnCBWWeg2pkTtn8yY8lBiZzE3VOdIzAo0UwQzASBgNVHRMBAf8ECDAGAQH/AgEAMA4GA1UdDwEB/wQEAwIBBjAdBgNVHQ4EFgQU/ElE7e3KGwtsuerSyFOrod1UxDkwCgYIKoZIzj0EAwIDRwAwRAIgEvuyBlQTNHXo+mzXWiFf2dzrU27ZovslezGL+2dpGjECIC8qbgvYpF6Smo4nBC+tzU2zxiOeRewqfpzAQqEvo4mF"],"crv":"P-256","x":"ALqhfTqLUgV5FH8bbJS1VYXFqSdaxkEUaHuuwSJjNFgq","y":"HhDj6RZtdM12WcIFZZ6DamRO2fzJjyUGJnMTdU50jMA"},"domain":"DCC","participant":"XL","keyusage":"SCA"},{"id":"did:web:tng-cdn-dev.who.int:v2:trustlist:-:XL:SCA#MD93Io4g9GE=","type":"JsonWebKey2020","controller":"did:web:tng-cdn-dev.who.int:v2:trustlist:-:XL","publicKeyJwk":{"kty":"EC","kid":"MD93Io4g9GE=","x5c":["MIICIDCCAcegAwIBAgIUeo8sCjTu/O8lEw5+msfG6Ss/qmAwCgYIKoZIzj0EAwIwbTELMAkGA1UEBhMCWEwxEzARBgNVBAgMClRlc3QgU3RhdGUxEzARBgNVBAcMCkNhbGlmb3JuaWExDzANBgNVBAoMBkNyZWF0ZTEMMAoGA1UECwwDUiZEMRUwEwYDVQQDDAxOYXRpb25YQ19UTlAwHhcNMjUwOTA1MjIyODExWhcNMjkwOTA1MjIyODExWjBtMQswCQYDVQQGEwJYTDETMBEGA1UECAwKVGVzdCBTdGF0ZTETMBEGA1UEBwwKQ2FsaWZvcm5pYTEPMA0GA1UECgwGQ3JlYXRlMQwwCgYDVQQLDANSJkQxFTATBgNVBAMMDE5hdGlvblhDX1ROUDBZMBMGByqGSM49AgEGCCqGSM49AwEHA0IABGyu+Fiohg8APhNR8M0ES2qC0bMXLQb8QCoAakFJ0yubhJku+Q1hJE1uXIJo1JMMMSqhWkH6ZLaroQgCrXEfeXqjRTBDMBIGA1UdEwEB/wQIMAYBAf8CAQAwDgYDVR0PAQH/BAQDAgEGMB0GA1UdDgQWBBQ6ucEi0XUzbXD4njquKtEXAtxYnzAKBggqhkjOPQQDAgNHADBEAiAYInGL6MNXhsxaHULBN7qoGdZU0fCUcU/Ga015QzDH6gIged0zuy/RlSqRb8BGgMwmJ9m/8WT82FpG2obN/QxPMGI="],"crv":"P-256","x":"bK74WKiGDwA-E1HwzQRLaoLRsxctBvxAKgBqQUnTK5s","y":"AISZLvkNYSRNblyCaNSTDDEqoVpB-mS2q6EIAq1xH3l6"},"domain":"PH4H","participant":"XL","keyusage":"SCA"},{"id":"did:web:tng-cdn-dev.who.int:v2:trustlist:-:XL:SCA#hRJFN+daQrI=","type":"JsonWebKey2020","controller":"did:web:tng-cdn-dev.who.int:v2:trustlist:-:XL","publicKeyJwk":{"kty":"EC","kid":"hRJFN+daQrI=","x5c":["MIICAjCCAaegAwIBAgIUKF4lTmfdzK4G2N70l0ZsuqwnvCUwCgYIKoZIzj0EAwIwXTELMAkGA1UEBhMCWEwxCzAJBgNVBAgMAk1UMREwDwYDVQQHDAhTYW50aWFnbzEPMA0GA1UECgwGQ3JlYXRlMQwwCgYDVQQLDANSJkQxDzANBgNVBAMMBkNyZWF0ZTAeFw0yNDA5MTAyMDUxMjhaFw0yODA5MTAyMDUxMjhaMF0xCzAJBgNVBAYTAlhMMQswCQYDVQQIDAJNVDERMA8GA1UEBwwIU2FudGlhZ28xDzANBgNVBAoMBkNyZWF0ZTEMMAoGA1UECwwDUiZEMQ8wDQYDVQQDDAZDcmVhdGUwWTATBgcqhkjOPQIBBggqhkjOPQMBBwNCAATwTvXHsCOZVe8cux/7YJF1Z5fTQJBWjiOlosaXWxi+72l4i8PECtFyEV+s1vk8ynZ8BSlEanXA7yWnzXf1mZsHo0UwQzASBgNVHRMBAf8ECDAGAQH/AgEAMA4GA1UdDwEB/wQEAwIBBjAdBgNVHQ4EFgQUltU4J1etuXVuGvSffa+h2q0xeGowCgYIKoZIzj0EAwIDSQAwRgIhAMbyCD/0VopFYhpYdxUWomzSwlH5iqBlgym9DmsTeUvwAiEA3CyeKGAibv5NIj7EkGazFTP+gvqAvPAqViVNty9TJWo="],"crv":"P-256","x":"APBO9cewI5lV7xy7H_tgkXVnl9NAkFaOI6WixpdbGL7v","y":"aXiLw8QK0XIRX6zW-TzKdnwFKURqdcDvJafNd_WZmwc"},"domain":"PH4H","participant":"XL","keyusage":"SCA"}],"proof":{"type":"JsonWebSignature2020","created":"2026-01-04T06:00:29Z","nonce":"xOyHVIU4A482TyNflMpPf5W4pvGgM5jK","proofPurpose":"assertionMethod","verificationMethod":"did:web:raw.githubusercontent.com:WorldHealthOrganization:tng-participants-dev:main:WHO:signing:DID","jws":"eyJiNjQiOmZhbHNlLCJjcml0IjpbImI2NCJdLCJhbGciOiJFUzI1NiJ9..MEUCIEQzahWS5kFJJLUdHHlB55WTXAV_O-ewBbIoc3wVp9HbAiEAu7kmM-7lKRvWZhwFefCxD32c-audnKjD0KtgLpXdvS8"}}