{"@context":["https://www.w3.org/ns/did/v1","https://w3id.org/security/suites/jws-2020/v1","https://worldhealthorganization.github.io/smart-trust/tng-additional-context/v1"],"id":"did:web:tng-cdn-dev.who.int:v2:trustlist:PH4H:XL","controller":"did:web:tng-cdn-dev.who.int:v2:trustlist:PH4H","verificationMethod":[{"id":"did:web:tng-cdn-dev.who.int:v2:trustlist:PH4H:XL:SCA#MD93Io4g9GE=","type":"JsonWebKey2020","controller":"did:web:tng-cdn-dev.who.int:v2:trustlist:PH4H","publicKeyJwk":{"kty":"EC","kid":"MD93Io4g9GE=","x5c":["MIICIDCCAcegAwIBAgIUeo8sCjTu/O8lEw5+msfG6Ss/qmAwCgYIKoZIzj0EAwIwbTELMAkGA1UEBhMCWEwxEzARBgNVBAgMClRlc3QgU3RhdGUxEzARBgNVBAcMCkNhbGlmb3JuaWExDzANBgNVBAoMBkNyZWF0ZTEMMAoGA1UECwwDUiZEMRUwEwYDVQQDDAxOYXRpb25YQ19UTlAwHhcNMjUwOTA1MjIyODExWhcNMjkwOTA1MjIyODExWjBtMQswCQYDVQQGEwJYTDETMBEGA1UECAwKVGVzdCBTdGF0ZTETMBEGA1UEBwwKQ2FsaWZvcm5pYTEPMA0GA1UECgwGQ3JlYXRlMQwwCgYDVQQLDANSJkQxFTATBgNVBAMMDE5hdGlvblhDX1ROUDBZMBMGByqGSM49AgEGCCqGSM49AwEHA0IABGyu+Fiohg8APhNR8M0ES2qC0bMXLQb8QCoAakFJ0yubhJku+Q1hJE1uXIJo1JMMMSqhWkH6ZLaroQgCrXEfeXqjRTBDMBIGA1UdEwEB/wQIMAYBAf8CAQAwDgYDVR0PAQH/BAQDAgEGMB0GA1UdDgQWBBQ6ucEi0XUzbXD4njquKtEXAtxYnzAKBggqhkjOPQQDAgNHADBEAiAYInGL6MNXhsxaHULBN7qoGdZU0fCUcU/Ga015QzDH6gIged0zuy/RlSqRb8BGgMwmJ9m/8WT82FpG2obN/QxPMGI="],"crv":"P-256","x":"bK74WKiGDwA-E1HwzQRLaoLRsxctBvxAKgBqQUnTK5s","y":"AISZLvkNYSRNblyCaNSTDDEqoVpB-mS2q6EIAq1xH3l6"},"domain":"PH4H","participant":"XL","keyusage":"SCA"},{"id":"did:web:tng-cdn-dev.who.int:v2:trustlist:PH4H:XL:SCA#hRJFN+daQrI=","type":"JsonWebKey2020","controller":"did:web:tng-cdn-dev.who.int:v2:trustlist:PH4H","publicKeyJwk":{"kty":"EC","kid":"hRJFN+daQrI=","x5c":["MIICAjCCAaegAwIBAgIUKF4lTmfdzK4G2N70l0ZsuqwnvCUwCgYIKoZIzj0EAwIwXTELMAkGA1UEBhMCWEwxCzAJBgNVBAgMAk1UMREwDwYDVQQHDAhTYW50aWFnbzEPMA0GA1UECgwGQ3JlYXRlMQwwCgYDVQQLDANSJkQxDzANBgNVBAMMBkNyZWF0ZTAeFw0yNDA5MTAyMDUxMjhaFw0yODA5MTAyMDUxMjhaMF0xCzAJBgNVBAYTAlhMMQswCQYDVQQIDAJNVDERMA8GA1UEBwwIU2FudGlhZ28xDzANBgNVBAoMBkNyZWF0ZTEMMAoGA1UECwwDUiZEMQ8wDQYDVQQDDAZDcmVhdGUwWTATBgcqhkjOPQIBBggqhkjOPQMBBwNCAATwTvXHsCOZVe8cux/7YJF1Z5fTQJBWjiOlosaXWxi+72l4i8PECtFyEV+s1vk8ynZ8BSlEanXA7yWnzXf1mZsHo0UwQzASBgNVHRMBAf8ECDAGAQH/AgEAMA4GA1UdDwEB/wQEAwIBBjAdBgNVHQ4EFgQUltU4J1etuXVuGvSffa+h2q0xeGowCgYIKoZIzj0EAwIDSQAwRgIhAMbyCD/0VopFYhpYdxUWomzSwlH5iqBlgym9DmsTeUvwAiEA3CyeKGAibv5NIj7EkGazFTP+gvqAvPAqViVNty9TJWo="],"crv":"P-256","x":"APBO9cewI5lV7xy7H_tgkXVnl9NAkFaOI6WixpdbGL7v","y":"aXiLw8QK0XIRX6zW-TzKdnwFKURqdcDvJafNd_WZmwc"},"domain":"PH4H","participant":"XL","keyusage":"SCA"},{"id":"did:web:tng-cdn-dev.who.int:v2:trustlist:PH4H:XL:DSC#lkxZC7WEOIs=","type":"JsonWebKey2020","controller":"did:web:tng-cdn-dev.who.int:v2:trustlist:PH4H","publicKeyJwk":{"kty":"EC","kid":"lkxZC7WEOIs=","x5c":["MIICoTCCAkegAwIBAgIUXyW8Eb8M4PiKkdr7IOs76K1KvgQwCgYIKoZIzj0EAwIwbTELMAkGA1UEBhMCWEwxEzARBgNVBAgMClRlc3QgU3RhdGUxEzARBgNVBAcMCkNhbGlmb3JuaWExDzANBgNVBAoMBkNyZWF0ZTEMMAoGA1UECwwDUiZEMRUwEwYDVQQDDAxOYXRpb25YQ19UTlAwHhcNMjUwOTE1MTYzNTMwWhcNMjcwOTE1MTYzNTMwWjBtMQswCQYDVQQGEwJYTDETMBEGA1UECAwKVGVzdCBTdGF0ZTETMBEGA1UEBwwKQ2FsaWZvcm5pYTEPMA0GA1UECgwGQ3JlYXRlMQwwCgYDVQQLDANSJkQxFTATBgNVBAMMDE5hdGlvblhDX1ROUDBZMBMGByqGSM49AgEGCCqGSM49AwEHA0IABFgLQ2NpmIdaotfGiR0DRQ3OXWj6nTS0aqUphzXVjCi6A+kULLvX3qB/1bDLnrvMSvpVqzzSq0GocSA+4f2OWxKjgcQwgcEwDgYDVR0PAQH/BAQDAgeAMB0GA1UdDgQWBBQlEhNfCSe2r4WafE/EyFSY0TTAIDAfBgNVHSMEGDAWgBQ6ucEi0XUzbXD4njquKtEXAtxYnzA9BgNVHR8ENjA0MDKgMKAuhixodHRwOi8vY3JsLmV4YW1wbGVkb21haW4uZXhhbXBsZS9DUkwvU0NBLmNybDAwBgNVHSUEKTAnBgsrBgEEAY43j2UBAQYLKwYBBAGON49lAQIGCysGAQQBjjePZQEDMAoGCCqGSM49BAMCA0gAMEUCIQCrOl1QmsOhzAXjYoTj26yVogte53eNqOKc6qrbtfZIGwIgH+lKLGJTo7wlyutgQ2EF49Bj7UFu3w9vP5Ri/Hp0voU=","MIICIDCCAcegAwIBAgIUeo8sCjTu/O8lEw5+msfG6Ss/qmAwCgYIKoZIzj0EAwIwbTELMAkGA1UEBhMCWEwxEzARBgNVBAgMClRlc3QgU3RhdGUxEzARBgNVBAcMCkNhbGlmb3JuaWExDzANBgNVBAoMBkNyZWF0ZTEMMAoGA1UECwwDUiZEMRUwEwYDVQQDDAxOYXRpb25YQ19UTlAwHhcNMjUwOTA1MjIyODExWhcNMjkwOTA1MjIyODExWjBtMQswCQYDVQQGEwJYTDETMBEGA1UECAwKVGVzdCBTdGF0ZTETMBEGA1UEBwwKQ2FsaWZvcm5pYTEPMA0GA1UECgwGQ3JlYXRlMQwwCgYDVQQLDANSJkQxFTATBgNVBAMMDE5hdGlvblhDX1ROUDBZMBMGByqGSM49AgEGCCqGSM49AwEHA0IABGyu+Fiohg8APhNR8M0ES2qC0bMXLQb8QCoAakFJ0yubhJku+Q1hJE1uXIJo1JMMMSqhWkH6ZLaroQgCrXEfeXqjRTBDMBIGA1UdEwEB/wQIMAYBAf8CAQAwDgYDVR0PAQH/BAQDAgEGMB0GA1UdDgQWBBQ6ucEi0XUzbXD4njquKtEXAtxYnzAKBggqhkjOPQQDAgNHADBEAiAYInGL6MNXhsxaHULBN7qoGdZU0fCUcU/Ga015QzDH6gIged0zuy/RlSqRb8BGgMwmJ9m/8WT82FpG2obN/QxPMGI="],"crv":"P-256","x":"WAtDY2mYh1qi18aJHQNFDc5daPqdNLRqpSmHNdWMKLo","y":"A-kULLvX3qB_1bDLnrvMSvpVqzzSq0GocSA-4f2OWxI"},"domain":"PH4H","participant":"XL","keyusage":"DSC"}],"proof":{"type":"JsonWebSignature2020","created":"2026-01-04T06:00:14Z","nonce":"R7PcJBL9m7SrhHBkcEWQrGJxTdeR5U5d","proofPurpose":"assertionMethod","verificationMethod":"did:web:raw.githubusercontent.com:WorldHealthOrganization:tng-participants-dev:main:WHO:signing:DID","jws":"eyJiNjQiOmZhbHNlLCJjcml0IjpbImI2NCJdLCJhbGciOiJFUzI1NiJ9..MEUCICV1hdQYUTa4lFq-lwylbTxXPZeKDjJ4x9n1uSH09AVIAiEAhYGR5qnGPw4UoicaXjYpbKCdyNNmJyoeeywp63sPGT8"}}