{"@context":["https://www.w3.org/ns/did/v1","https://w3id.org/security/suites/jws-2020/v1","https://worldhealthorganization.github.io/smart-trust/tng-additional-context/v1"],"id":"did:web:tng-cdn-dev.who.int:v2:trustlist:DCC:XV:DSC","controller":"did:web:tng-cdn-dev.who.int:v2:trustlist:DCC:XV","verificationMethod":[{"id":"did:web:tng-cdn-dev.who.int:v2:trustlist:DCC:XV:DSC#9hJbmczFOn8=","type":"JsonWebKey2020","controller":"did:web:tng-cdn-dev.who.int:v2:trustlist:DCC:XV","publicKeyJwk":{"kty":"EC","kid":"9hJbmczFOn8=","x5c":["MIICkDCCAjWgAwIBAgIUVVA2TzUxgDj2aXWWWgQnxx6xMBUwCgYIKoZIzj0EAwQwZDELMAkGA1UEBhMCWFYxEzARBgNVBAgMClRlc3QgU3RhdGUxDTALBgNVBAcMBFRFU1QxDDAKBgNVBAoMA1dITzEMMAoGA1UECwwDUiZEMRUwEwYDVQQDDAxOYXRpb25YVl9UTlAwHhcNMjUwOTAxMTA1NzI2WhcNMjcwOTAxMTA1NzI2WjBkMQswCQYDVQQGEwJYVjETMBEGA1UECAwKVGVzdCBTdGF0ZTENMAsGA1UEBwwEVEVTVDEMMAoGA1UECgwDV0hPMQwwCgYDVQQLDANSJkQxFTATBgNVBAMMDE5hdGlvblhWX1ROUDBZMBMGByqGSM49AgEGCCqGSM49AwEHA0IABDV4lMctzTa/lV06vJ+TRa5s1vl2fvPTvXSv2UftPlICQKxpYfc4lag2fwNS2n8FH73WcEE9szy6hqpoL9mAdY+jgcQwgcEwDgYDVR0PAQH/BAQDAgeAMB0GA1UdDgQWBBTfWFJyyJ/ARX72OxnBSO+rTL4Q8DAfBgNVHSMEGDAWgBShd9Ym72gdGfWqqXd7Z4GP0wEKrDA9BgNVHR8ENjA0MDKgMKAuhixodHRwOi8vY3JsLmV4YW1wbGVkb21haW4uZXhhbXBsZS9DUkwvU0NBLmNybDAwBgNVHSUEKTAnBgsrBgEEAY43j2UBAQYLKwYBBAGON49lAQIGCysGAQQBjjePZQEDMAoGCCqGSM49BAMEA0kAMEYCIQChgymN7LD1apWdO9I4wQz+Wu5nwH/g/ztvyxTslCxYuAIhAKZigtiskuZksJJpWVh5EnBvA1AQAK4sV0mUg8pN1GAE","MIICDzCCAbWgAwIBAgIUByPWCqZ1JVl/kRq4q5kshH5Ik+gwCgYIKoZIzj0EAwQwZDELMAkGA1UEBhMCWFYxEzARBgNVBAgMClRlc3QgU3RhdGUxDTALBgNVBAcMBFRFU1QxDDAKBgNVBAoMA1dITzEMMAoGA1UECwwDUiZEMRUwEwYDVQQDDAxOYXRpb25YVl9UTlAwHhcNMjUwOTAxMDk1MzU3WhcNMjkwOTAxMDk1MzU3WjBkMQswCQYDVQQGEwJYVjETMBEGA1UECAwKVGVzdCBTdGF0ZTENMAsGA1UEBwwEVEVTVDEMMAoGA1UECgwDV0hPMQwwCgYDVQQLDANSJkQxFTATBgNVBAMMDE5hdGlvblhWX1ROUDBZMBMGByqGSM49AgEGCCqGSM49AwEHA0IABDopop2wk9cKLqZBkgEPw0HBgr3p6yUmAayCrIXut83ScLMd45HfxU1xcOuS33ZumO47xapf2UDVgVinyAdm5eGjRTBDMBIGA1UdEwEB/wQIMAYBAf8CAQAwDgYDVR0PAQH/BAQDAgEGMB0GA1UdDgQWBBShd9Ym72gdGfWqqXd7Z4GP0wEKrDAKBggqhkjOPQQDBANIADBFAiBjQC0cxPM5KLzDUtQsoLFbqzB6mLu9qU36Dpq+5dCF1gIhAPLqMwuqh41kgA1SzSoV7sovSwxHvp0rxhTD5pfGrm2K"],"crv":"P-256","x":"NXiUxy3NNr-VXTq8n5NFrmzW-XZ-89O9dK_ZR-0-UgI","y":"QKxpYfc4lag2fwNS2n8FH73WcEE9szy6hqpoL9mAdY8"},"domain":"DCC","participant":"XV","keyusage":"DSC"},{"id":"did:web:tng-cdn-dev.who.int:v2:trustlist:DCC:XV:DSC#nPsnRUYfcgc=","type":"JsonWebKey2020","controller":"did:web:tng-cdn-dev.who.int:v2:trustlist:DCC:XV","publicKeyJwk":{"kty":"EC","kid":"nPsnRUYfcgc=","x5c":["MIIChTCCAiqgAwIBAgIUP2WstZcKc0lNL2mGYGE45vBDBVIwCgYIKoZIzj0EAwIwWjELMAkGA1UEBhMCWFYxDTALBgNVBAgMBHRlc3QxDjAMBgNVBAcMBUluZGlhMQwwCgYDVQQKDANXSE8xEDAOBgNVBAsMB09wc3RlYW0xDDAKBgNVBAMMA1NDQTAeFw0yNTEwMjAxMTMxMDBaFw0yNzEwMjAxMTMyMDBaMGMxCzAJBgNVBAYTAlhWMQ0wCwYDVQQIDAR0ZXN0MQ4wDAYDVQQHDAVJTkRJQTEMMAoGA1UECgwDV0hPMRAwDgYDVQQLDAdvcHN0ZWFtMRUwEwYDVQQDDAxOYXRpb25YVl9UTlAwWTATBgcqhkjOPQIBBggqhkjOPQMBBwNCAAT7a64eYQ/R69TQZI5lp8IqSBtVtCRikEntpCQaRlvpTpItI3ON25bI15nTLu1u86RWf5J4y2QUFHY4hSIXIgJjo4HEMIHBMB0GA1UdDgQWBBS7Qcw2j6gsFlr5ITDGMBZS+GmYsTAfBgNVHSMEGDAWgBTBIjBO1xkolAaASgmXDwpSLHd5/zAOBgNVHQ8BAf8EBAMCB4AwMAYDVR0lBCkwJwYLKwYBBAGON49lAQEGCysGAQQBjjePZQECBgsrBgEEAY43j2UBAzA9BgNVHR8ENjA0MDKgMKAuhixodHRwOi8vY3JsLmV4YW1wbGVkb21haW4uZXhhbXBsZS9DUkwvU0NBLmNybDAKBggqhkjOPQQDAgNJADBGAiEAz+Z3CJoHNSc10s2SNKT5yAUZsohw9i4CA1GDQRr3KukCIQD4sEZDEZEN1NmbmbOrOmGZtAQVvp683AtDe/6JOzaZzQ==","MIIB/DCCAaGgAwIBAgIUTPIJMvNw8eS1OhG2tQ+W44LHZrAwCgYIKoZIzj0EAwMwWjELMAkGA1UEBhMCWFYxDTALBgNVBAgMBHRlc3QxDjAMBgNVBAcMBUluZGlhMQwwCgYDVQQKDANXSE8xEDAOBgNVBAsMB09wc3RlYW0xDDAKBgNVBAMMA1NDQTAeFw0yNTEwMjAxMDUzMzdaFw0yOTEwMTkxMDUzMzdaMFoxCzAJBgNVBAYTAlhWMQ0wCwYDVQQIDAR0ZXN0MQ4wDAYDVQQHDAVJbmRpYTEMMAoGA1UECgwDV0hPMRAwDgYDVQQLDAdPcHN0ZWFtMQwwCgYDVQQDDANTQ0EwWTATBgcqhkjOPQIBBggqhkjOPQMBBwNCAATEWCv+9opPsLf4eh5h5N+nLfgPOrIxXuqokW27vBtXuCKCO6VHyKHOqQ8IdPE0LZbISH1qfKxDmIIxRTh1hRW8o0UwQzASBgNVHRMBAf8ECDAGAQH/AgEAMA4GA1UdDwEB/wQEAwIBBjAdBgNVHQ4EFgQUwSIwTtcZKJQGgEoJlw8KUix3ef8wCgYIKoZIzj0EAwMDSQAwRgIhAJrA2OvM1CaKvgWmoFUQ99Kr7yhTjtAh+HKS98+hZVHmAiEA9HYIEfGy2tTMcpMOV8AnF6kxWqYMk2myhzpMoDC9ROo="],"crv":"P-256","x":"APtrrh5hD9Hr1NBkjmWnwipIG1W0JGKQSe2kJBpGW-lO","y":"AJItI3ON25bI15nTLu1u86RWf5J4y2QUFHY4hSIXIgJj"},"domain":"DCC","participant":"XV","keyusage":"DSC"}],"proof":{"type":"JsonWebSignature2020","created":"2025-12-06T12:00:18Z","nonce":"xmjBk4PLBwavYhiMk2RFSTwpJCuaJ9iI","proofPurpose":"assertionMethod","verificationMethod":"did:web:raw.githubusercontent.com:WorldHealthOrganization:tng-participants-dev:main:WHO:signing:DID","jws":"eyJiNjQiOmZhbHNlLCJjcml0IjpbImI2NCJdLCJhbGciOiJFUzI1NiJ9..MEQCIFYZhW71NqNntgfYtmLULNrllLDKjycQGhAUCdncWxmzAiBS3SLNQjU76uS-qF82yRh2lFSPlYU6GOGOewPY89p3yQ"}}