{"@context":["https://www.w3.org/ns/did/v1","https://w3id.org/security/suites/jws-2020/v1","https://worldhealthorganization.github.io/smart-trust/tng-additional-context/v1"],"id":"did:web:tng-cdn-dev.who.int:v2:trustlist:DCC:XB","controller":"did:web:tng-cdn-dev.who.int:v2:trustlist:DCC","verificationMethod":[{"id":"did:web:tng-cdn-dev.who.int:v2:trustlist:DCC:XB:SCA#UtbQjTdyhMA=","type":"JsonWebKey2020","controller":"did:web:tng-cdn-dev.who.int:v2:trustlist:DCC","publicKeyJwk":{"kty":"EC","kid":"UtbQjTdyhMA=","x5c":["MIICEDCCAbWgAwIBAgIUF8kxuZF7adI6n7Wj6o9d6sx9TxIwCgYIKoZIzj0EAwIwZDELMAkGA1UEBhMCWEIxEzARBgNVBAgMClRlc3QgU3RhdGUxDTALBgNVBAcMBFRFU1QxDDAKBgNVBAoMA1dITzEMMAoGA1UECwwDUiZEMRUwEwYDVQQDDAxOYXRpb25YQl9UTlAwHhcNMjUwNTI4MDUxMDQ4WhcNMjkwNTI4MDUxMDQ4WjBkMQswCQYDVQQGEwJYQjETMBEGA1UECAwKVGVzdCBTdGF0ZTENMAsGA1UEBwwEVEVTVDEMMAoGA1UECgwDV0hPMQwwCgYDVQQLDANSJkQxFTATBgNVBAMMDE5hdGlvblhCX1ROUDBZMBMGByqGSM49AgEGCCqGSM49AwEHA0IABFLx7QLZrgVVmq55yO3iZ8uWnJdSSfeTmrsyWAb0lUFcNvngFcpXPLA2+Q89A8pgjiAbeCvA+v589ZTbnD0sKAejRTBDMBIGA1UdEwEB/wQIMAYBAf8CAQAwDgYDVR0PAQH/BAQDAgEGMB0GA1UdDgQWBBTil6VV5lPoLhiXm0swDHAnxcHnHjAKBggqhkjOPQQDAgNJADBGAiEAi6iQ6WE/6a2aCLWp6HoDSYm4U9Fkuj6Sv57NAjJqY2sCIQCkgtLYg11QAeHby7m2eNHWtg0slAqDAC5DPvXJMFRe+g=="],"crv":"P-256","x":"UvHtAtmuBVWarnnI7eJny5acl1JJ95OauzJYBvSVQVw","y":"NvngFcpXPLA2-Q89A8pgjiAbeCvA-v589ZTbnD0sKAc"},"domain":"DCC","participant":"XB","keyusage":"SCA"},{"id":"did:web:tng-cdn-dev.who.int:v2:trustlist:DCC:XB:DESC#fESlKlyv1ZY=","type":"JsonWebKey2020","controller":"did:web:tng-cdn-dev.who.int:v2:trustlist:DCC","publicKeyJwk":{"kty":"EC","kid":"fESlKlyv1ZY=","x5c":["MIIB8jCCAZegAwIBAgIUdrWof+iQo0AtgirPiTTdeVOrPX0wCgYIKoZIzj0EAwIwZDELMAkGA1UEBhMCWEIxEzARBgNVBAgMClRlc3QgU3RhdGUxDTALBgNVBAcMBFRFU1QxDDAKBgNVBAoMA1dITzEMMAoGA1UECwwDUiZEMRUwEwYDVQQDDAxOYXRpb25YQl9UTlAwHhcNMjUwNTI4MDUzNTE5WhcNMjcwNTI4MDUzNTE5WjBkMQswCQYDVQQGEwJYQjETMBEGA1UECAwKVGVzdCBTdGF0ZTENMAsGA1UEBwwEVEVTVDEMMAoGA1UECgwDV0hPMQwwCgYDVQQLDANSJkQxFTATBgNVBAMMDE5hdGlvblhCX1ROUDBZMBMGByqGSM49AgEGCCqGSM49AwEHA0IABAn7qNLvMRLjxpUDTBjBYRw3zXOZajLCRt7+38A4I1sMQmMyvM16SruF2iIyQcEOPJhLURqoR6Pa5sOwFtQfzSijJzAlMA4GA1UdDwEB/wQEAwIChDATBgNVHSUEDDAKBggrBgEFBQcDAjAKBggqhkjOPQQDAgNJADBGAiEA0zIiyHwxPo+5OAaCq8OMY3K/FPtMX8CbeIl3gErPKVcCIQDAjCEWxLBdUV6UeysmS0yoErHteXJc6147vlB9gtHavQ==","MIIB8jCCAZegAwIBAgIUYETlKy3eYs+cIEWGWbctYG44LwgwCgYIKoZIzj0EAwIwZDELMAkGA1UEBhMCWEIxEzARBgNVBAgMClRlc3QgU3RhdGUxDTALBgNVBAcMBFRFU1QxDDAKBgNVBAoMA1dITzEMMAoGA1UECwwDUiZEMRUwEwYDVQQDDAxOYXRpb25YQl9UTlAwHhcNMjUwNTI4MDUxMDQ4WhcNMjkwNTI4MDUxMDQ4WjBkMQswCQYDVQQGEwJYQjETMBEGA1UECAwKVGVzdCBTdGF0ZTENMAsGA1UEBwwEVEVTVDEMMAoGA1UECgwDV0hPMQwwCgYDVQQLDANSJkQxFTATBgNVBAMMDE5hdGlvblhCX1ROUDBZMBMGByqGSM49AgEGCCqGSM49AwEHA0IABIMmZeYgJu6a3xRodxDx6ccN/VzfY83sWHf32s9INgbqCFnJUw8GrxkFGuckvPmExxIDZPmwd0NxzcHmgdm09RKjJzAlMA4GA1UdDwEB/wQEAwIChDATBgNVHSUEDDAKBggrBgEFBQcDAjAKBggqhkjOPQQDAgNJADBGAiEA3M34MFYJ9ixe1+sDQgGGTss7ZdUa4rKjrz9tbMEd6gICIQDBaXJFSyfdLN4I0CvaPlcXBUy3agVUTgepCozNbtdpOA=="],"crv":"P-256","x":"Cfuo0u8xEuPGlQNMGMFhHDfNc5lqMsJG3v7fwDgjWww","y":"QmMyvM16SruF2iIyQcEOPJhLURqoR6Pa5sOwFtQfzSg"},"domain":"DCC","participant":"XB","keyusage":"DESC"},{"id":"did:web:tng-cdn-dev.who.int:v2:trustlist:DCC:XB:DECA#sMaCYKqD7Cc=","type":"JsonWebKey2020","controller":"did:web:tng-cdn-dev.who.int:v2:trustlist:DCC","publicKeyJwk":{"kty":"EC","kid":"sMaCYKqD7Cc=","x5c":["MIIB8jCCAZegAwIBAgIUYETlKy3eYs+cIEWGWbctYG44LwgwCgYIKoZIzj0EAwIwZDELMAkGA1UEBhMCWEIxEzARBgNVBAgMClRlc3QgU3RhdGUxDTALBgNVBAcMBFRFU1QxDDAKBgNVBAoMA1dITzEMMAoGA1UECwwDUiZEMRUwEwYDVQQDDAxOYXRpb25YQl9UTlAwHhcNMjUwNTI4MDUxMDQ4WhcNMjkwNTI4MDUxMDQ4WjBkMQswCQYDVQQGEwJYQjETMBEGA1UECAwKVGVzdCBTdGF0ZTENMAsGA1UEBwwEVEVTVDEMMAoGA1UECgwDV0hPMQwwCgYDVQQLDANSJkQxFTATBgNVBAMMDE5hdGlvblhCX1ROUDBZMBMGByqGSM49AgEGCCqGSM49AwEHA0IABIMmZeYgJu6a3xRodxDx6ccN/VzfY83sWHf32s9INgbqCFnJUw8GrxkFGuckvPmExxIDZPmwd0NxzcHmgdm09RKjJzAlMA4GA1UdDwEB/wQEAwIChDATBgNVHSUEDDAKBggrBgEFBQcDAjAKBggqhkjOPQQDAgNJADBGAiEA3M34MFYJ9ixe1+sDQgGGTss7ZdUa4rKjrz9tbMEd6gICIQDBaXJFSyfdLN4I0CvaPlcXBUy3agVUTgepCozNbtdpOA=="],"crv":"P-256","x":"AIMmZeYgJu6a3xRodxDx6ccN_VzfY83sWHf32s9INgbq","y":"CFnJUw8GrxkFGuckvPmExxIDZPmwd0NxzcHmgdm09RI"},"domain":"DCC","participant":"XB","keyusage":"DECA"}],"proof":{"type":"JsonWebSignature2020","created":"2026-01-04T06:00:11Z","nonce":"WtNKDyDA1g2AKFSlF07E12HV2j0J0em1","proofPurpose":"assertionMethod","verificationMethod":"did:web:raw.githubusercontent.com:WorldHealthOrganization:tng-participants-dev:main:WHO:signing:DID","jws":"eyJiNjQiOmZhbHNlLCJjcml0IjpbImI2NCJdLCJhbGciOiJFUzI1NiJ9..MEQCIBLD9fl_OrsutP5DvqFg_vsoi6mFOA-pPZBz7gX3aIRxAiAKtBO6_Y3OBQKw55gfv4TiQpv577qtX5wfku4f6mBBnA"}}