{"@context":["https://www.w3.org/ns/did/v1","https://w3id.org/security/suites/jws-2020/v1"],"id":"did:web:tng-cdn-dev.who.int:v2:trustlist:PH4H:XJ:DSC","controller":"did:web:tng-cdn-dev.who.int:v2:trustlist:PH4H:XJ","verificationMethod":[{"id":"did:web:tng-cdn-dev.who.int:v2:trustlist:PH4H:XJ:DSC#I1BAX8FATLs=","type":"JsonWebKey2020","controller":"did:web:tng-cdn-dev.who.int:v2:trustlist:PH4H:XJ","publicKeyJwk":{"kty":"EC","kid":"I1BAX8FATLs=","x5c":["MIICpjCCAkygAwIBAgIURDYp9AbORfgP9bf+ObdVpZmPhDQwCgYIKoZIzj0EAwIwajELMAkGA1UEBhMCWEoxEzARBgNVBAgMClRlc3QgU3RhdGUxDzANBgNVBAcMBkdlbmV2YTEMMAoGA1UECgwDV0hPMQwwCgYDVQQLDANSJkQxGTAXBgNVBAMMEE5hdGlvblhKX1ROUF9TQ0EwHhcNMjQxMDAzMTI0OTAwWhcNMjYxMDAzMTI0OTAwWjB1MQswCQYDVQQGEwJYSjETMBEGA1UECAwKVGVzdCBTdGF0ZTEPMA0GA1UEBwwGR2VuZXZhMQwwCgYDVQQKDANXSE8xDDAKBgNVBAsMA1ImRDEkMCIGA1UEAwwbSGVhbHRoIEFkbWluaXN0cmF0aW9uIG9mIFhKMFkwEwYHKoZIzj0CAQYIKoZIzj0DAQcDQgAED2DolXPl+/M2H+vYoh2DuC+eeElyV7Ah+tXAYP7XjEgF3XrH1mNfzyUqoGu0FduPWhvxANA/da38f+9K8K30oqOBxDCBwTAOBgNVHQ8BAf8EBAMCB4AwHQYDVR0OBBYEFIoZa0IBL5BwoiTG3W2KwbK+eT3ZMB8GA1UdIwQYMBaAFBgehL4frCZdyg4bY5wayH0gXujiMD0GA1UdHwQ2MDQwMqAwoC6GLGh0dHA6Ly9jcmwuZXhhbXBsZWRvbWFpbi5leGFtcGxlL0NSTC9TQ0EuY3JsMDAGA1UdJQQpMCcGCysGAQQBjjePZQEBBgsrBgEEAY43j2UBAgYLKwYBBAGON49lAQMwCgYIKoZIzj0EAwIDSAAwRQIhALNDwRKfOuYoL24AzCH1i5yhUIhD3AMODBjQU+W9qLABAiAop0w+ExucFOHjt/mQWwd9yeFfPcepcVbd54yM10MdMg==","MIICGzCCAcGgAwIBAgIUWyouM/fxtzeZyzVwzWZhADcTRW0wCgYIKoZIzj0EAwIwajELMAkGA1UEBhMCWEoxEzARBgNVBAgMClRlc3QgU3RhdGUxDzANBgNVBAcMBkdlbmV2YTEMMAoGA1UECgwDV0hPMQwwCgYDVQQLDANSJkQxGTAXBgNVBAMMEE5hdGlvblhKX1ROUF9TQ0EwHhcNMjQxMDAyMTMyMTA3WhcNMjgxMDAyMTMyMTA3WjBqMQswCQYDVQQGEwJYSjETMBEGA1UECAwKVGVzdCBTdGF0ZTEPMA0GA1UEBwwGR2VuZXZhMQwwCgYDVQQKDANXSE8xDDAKBgNVBAsMA1ImRDEZMBcGA1UEAwwQTmF0aW9uWEpfVE5QX1NDQTBZMBMGByqGSM49AgEGCCqGSM49AwEHA0IABCugeSkBX+/Y76WZuihSJJQsGZg9Qn5bWBTl0AQr7X2uLf0jyKMKO5rmvZW/koRaM+E6tVFYZ7ljo9e8MWsMp2CjRTBDMBIGA1UdEwEB/wQIMAYBAf8CAQAwDgYDVR0PAQH/BAQDAgEGMB0GA1UdDgQWBBQYHoS+H6wmXcoOG2OcGsh9IF7o4jAKBggqhkjOPQQDAgNIADBFAiB5BMv0I39j405EzluroVv8iKjmSCodB16TVgV8lxFC4wIhAKVy5hLN5YCjVo9FLx5ITjbyChuplM8UHCwpvX/+BW0m"],"crv":"P-256","x":"D2DolXPl-_M2H-vYoh2DuC-eeElyV7Ah-tXAYP7XjEg","y":"Bd16x9ZjX88lKqBrtBXbj1ob8QDQP3Wt_H_vSvCt9KI"},"domain":"PH4H","participant":"XJ","keyusage":"DSC"}],"proof":{"type":"JsonWebSignature2020","created":"2025-07-12T12:00:22Z","nonce":"y5PQlzRhlwMj1ks28LhZzi38Kes6te2F","proofPurpose":"assertionMethod","verificationMethod":"did:web:raw.githubusercontent.com:WorldHealthOrganization:tng-participants-dev:main:WHO:signing:DID","jws":"eyJiNjQiOmZhbHNlLCJjcml0IjpbImI2NCJdLCJhbGciOiJFUzI1NiJ9..MEQCIGpER1-cGPIT66GNcH7HmGuBMFhQoAOcGrJZtqtCPLavAiBPaKhfIAXJVNo_7nffq6b5X1zY68VcSkvBjE3usYGFvA"}}