{"@context":["https://www.w3.org/ns/did/v1","https://w3id.org/security/suites/jws-2020/v1","https://worldhealthorganization.github.io/smart-trust/tng-additional-context/v1"],"id":"did:web:tng-cdn-dev.who.int:v2:trustlist:IPS:XA","controller":"did:web:tng-cdn-dev.who.int:v2:trustlist:IPS","verificationMethod":[{"id":"did:web:tng-cdn-dev.who.int:v2:trustlist:IPS:XA:DSC#pkALteuRyCY=","type":"JsonWebKey2020","controller":"did:web:tng-cdn-dev.who.int:v2:trustlist:IPS","publicKeyJwk":{"kty":"EC","kid":"pkALteuRyCY=","x5c":["MIICujCCAmCgAwIBAgIUD9k1Q64Eav5r07DQ4Gff/7h7r6YwCgYIKoZIzj0EAwIwdDELMAkGA1UEBhMCWEExFDASBgNVBAgMC1hYQSBDb3VudHJ5MRgwFgYDVQQHDA9YQSBDYXBpdG9sIENpdHkxDDAKBgNVBAoMA1dITzEMMAoGA1UECwwDUiZEMRkwFwYDVQQDDBBOYXRpb25YQV9UTlBfU0NBMB4XDTI0MDgwMjEzNDYwNFoXDTI2MDgwMjEzNDYwNFowfzELMAkGA1UEBhMCWEExFDASBgNVBAgMC1hYQSBDb3VudHJ5MRgwFgYDVQQHDA9YQSBDYXBpdG9sIENpdHkxDDAKBgNVBAoMA1dITzEMMAoGA1UECwwDUiZEMSQwIgYDVQQDDBtIZWFsdGggQWRtaW5pc3RyYXRpb24gb2YgWEEwWTATBgcqhkjOPQIBBggqhkjOPQMBBwNCAASDKWDGfNBTbukclQq5IclHicmif4bcO3BPqpQe7ZWifXGo2YmL1zk/OALnEtADncDn/AlqOeUvHdG20oN9Qu59o4HEMIHBMA4GA1UdDwEB/wQEAwIHgDAdBgNVHQ4EFgQUEJx8fGMtJI49arbr4PojpNr/TQowHwYDVR0jBBgwFoAUoir+zkKsSL7OkG8dPyThX49GLtEwPQYDVR0fBDYwNDAyoDCgLoYsaHR0cDovL2NybC5leGFtcGxlZG9tYWluLmV4YW1wbGUvQ1JML1NDQS5jcmwwMAYDVR0lBCkwJwYLKwYBBAGON49lAQEGCysGAQQBjjePZQECBgsrBgEEAY43j2UBAzAKBggqhkjOPQQDAgNIADBFAiEAsTnM65VZUgaMPdJCD1i4Eo5D29EDhKCJQSOxQd4pARMCIAoeNGihm66wBUa1qCMaAutmn9rILmYodnCemNMjJ+p6"],"crv":"P-256","x":"AIMpYMZ80FNu6RyVCrkhyUeJyaJ_htw7cE-qlB7tlaJ9","y":"cajZiYvXOT84AucS0AOdwOf8CWo55S8d0bbSg31C7n0"},"domain":"IPS","participant":"XA","keyusage":"DSC"}],"proof":{"type":"JsonWebSignature2020","created":"2026-01-04T06:00:11Z","nonce":"r9zP8tKpbyBpqaPIan6BZXjGfrONCgk3","proofPurpose":"assertionMethod","verificationMethod":"did:web:raw.githubusercontent.com:WorldHealthOrganization:tng-participants-dev:main:WHO:signing:DID","jws":"eyJiNjQiOmZhbHNlLCJjcml0IjpbImI2NCJdLCJhbGciOiJFUzI1NiJ9..MEUCIQDa4zOpoEQvEzN2TnDZDI2pAv1DTBRyhizPBXpHBsBAwAIgP1jttM_EaxjZqAZP03C3KaTGSN7FztKB13O8oxsyyJA"}}