{"@context":["https://www.w3.org/ns/did/v1","https://w3id.org/security/suites/jws-2020/v1","https://worldhealthorganization.github.io/smart-trust/tng-additional-context/v1"],"id":"did:web:tng-cdn-dev.who.int:v2:trustlist:PH4H:XA:SCA","controller":"did:web:tng-cdn-dev.who.int:v2:trustlist:PH4H:XA","verificationMethod":[{"id":"did:web:tng-cdn-dev.who.int:v2:trustlist:PH4H:XA:SCA#/Eg0veXxFzY=","type":"JsonWebKey2020","controller":"did:web:tng-cdn-dev.who.int:v2:trustlist:PH4H:XA","publicKeyJwk":{"kty":"EC","kid":"/Eg0veXxFzY=","x5c":["MIICGzCCAcGgAwIBAgIUV9fOwm0PmJmdzPbhlgDwMbeon4YwCgYIKoZIzj0EAwIwajELMAkGA1UEBhMCWEExEzARBgNVBAgMClRlc3QgU3RhdGUxDzANBgNVBAcMBkdlbmV2YTEMMAoGA1UECgwDV0hPMQwwCgYDVQQLDANSJkQxGTAXBgNVBAMMEE5hdGlvblhBX1ROUF9TQ0EwHhcNMjQwOTI2MTg1MDMyWhcNMjgwOTI2MTg1MDMyWjBqMQswCQYDVQQGEwJYQTETMBEGA1UECAwKVGVzdCBTdGF0ZTEPMA0GA1UEBwwGR2VuZXZhMQwwCgYDVQQKDANXSE8xDDAKBgNVBAsMA1ImRDEZMBcGA1UEAwwQTmF0aW9uWEFfVE5QX1NDQTBZMBMGByqGSM49AgEGCCqGSM49AwEHA0IABAqP53p92SogYMFOXmUQYH+UK5wrwNzTrCyMmuiOtpmeE3eTuW3BN3h1hbS79fRlSmToVSi41Q4oTJQSsnJgLumjRTBDMBIGA1UdEwEB/wQIMAYBAf8CAQAwDgYDVR0PAQH/BAQDAgEGMB0GA1UdDgQWBBQoP/9IfJbyXXM8OlnDagS1M7jJfDAKBggqhkjOPQQDAgNIADBFAiEA+Fz0eeH7QvxJoclPzva8qHwzoHZ8eRPygaKKDh1ggRgCICl60ioWmA6dPOtWx9uj0+QVUh12yGSBoOr0VIMgg9tq"],"crv":"P-256","x":"Co_nen3ZKiBgwU5eZRBgf5QrnCvA3NOsLIya6I62mZ4","y":"E3eTuW3BN3h1hbS79fRlSmToVSi41Q4oTJQSsnJgLuk"},"domain":"PH4H","participant":"XA","keyusage":"SCA"}],"proof":{"type":"JsonWebSignature2020","created":"2026-01-04T06:00:25Z","nonce":"eMMAZPOtiLTWE2J6rfc2LVPI9l5Hu3wh","proofPurpose":"assertionMethod","verificationMethod":"did:web:raw.githubusercontent.com:WorldHealthOrganization:tng-participants-dev:main:WHO:signing:DID","jws":"eyJiNjQiOmZhbHNlLCJjcml0IjpbImI2NCJdLCJhbGciOiJFUzI1NiJ9..MEUCIQDhVzBTI0W291wQSkHOjF099LDssYST08_pPqkTR5I8WgIgEVtbqILp43lIDkRGNrQFZqQhLXogG4gELxs3yOAZCU0"}}