{"@context":["https://www.w3.org/ns/did/v1","https://w3id.org/security/suites/jws-2020/v1","https://worldhealthorganization.github.io/smart-trust/tng-additional-context/v1"],"id":"did:web:tng-cdn-dev.who.int:v2:trustlist:PH4H:XL:DSC","controller":"did:web:tng-cdn-dev.who.int:v2:trustlist:PH4H:XL","verificationMethod":[{"id":"did:web:tng-cdn-dev.who.int:v2:trustlist:PH4H:XL:DSC#lkxZC7WEOIs=","type":"JsonWebKey2020","controller":"did:web:tng-cdn-dev.who.int:v2:trustlist:PH4H:XL","publicKeyJwk":{"kty":"EC","kid":"lkxZC7WEOIs=","x5c":["MIICoTCCAkegAwIBAgIUXyW8Eb8M4PiKkdr7IOs76K1KvgQwCgYIKoZIzj0EAwIwbTELMAkGA1UEBhMCWEwxEzARBgNVBAgMClRlc3QgU3RhdGUxEzARBgNVBAcMCkNhbGlmb3JuaWExDzANBgNVBAoMBkNyZWF0ZTEMMAoGA1UECwwDUiZEMRUwEwYDVQQDDAxOYXRpb25YQ19UTlAwHhcNMjUwOTE1MTYzNTMwWhcNMjcwOTE1MTYzNTMwWjBtMQswCQYDVQQGEwJYTDETMBEGA1UECAwKVGVzdCBTdGF0ZTETMBEGA1UEBwwKQ2FsaWZvcm5pYTEPMA0GA1UECgwGQ3JlYXRlMQwwCgYDVQQLDANSJkQxFTATBgNVBAMMDE5hdGlvblhDX1ROUDBZMBMGByqGSM49AgEGCCqGSM49AwEHA0IABFgLQ2NpmIdaotfGiR0DRQ3OXWj6nTS0aqUphzXVjCi6A+kULLvX3qB/1bDLnrvMSvpVqzzSq0GocSA+4f2OWxKjgcQwgcEwDgYDVR0PAQH/BAQDAgeAMB0GA1UdDgQWBBQlEhNfCSe2r4WafE/EyFSY0TTAIDAfBgNVHSMEGDAWgBQ6ucEi0XUzbXD4njquKtEXAtxYnzA9BgNVHR8ENjA0MDKgMKAuhixodHRwOi8vY3JsLmV4YW1wbGVkb21haW4uZXhhbXBsZS9DUkwvU0NBLmNybDAwBgNVHSUEKTAnBgsrBgEEAY43j2UBAQYLKwYBBAGON49lAQIGCysGAQQBjjePZQEDMAoGCCqGSM49BAMCA0gAMEUCIQCrOl1QmsOhzAXjYoTj26yVogte53eNqOKc6qrbtfZIGwIgH+lKLGJTo7wlyutgQ2EF49Bj7UFu3w9vP5Ri/Hp0voU=","MIICIDCCAcegAwIBAgIUeo8sCjTu/O8lEw5+msfG6Ss/qmAwCgYIKoZIzj0EAwIwbTELMAkGA1UEBhMCWEwxEzARBgNVBAgMClRlc3QgU3RhdGUxEzARBgNVBAcMCkNhbGlmb3JuaWExDzANBgNVBAoMBkNyZWF0ZTEMMAoGA1UECwwDUiZEMRUwEwYDVQQDDAxOYXRpb25YQ19UTlAwHhcNMjUwOTA1MjIyODExWhcNMjkwOTA1MjIyODExWjBtMQswCQYDVQQGEwJYTDETMBEGA1UECAwKVGVzdCBTdGF0ZTETMBEGA1UEBwwKQ2FsaWZvcm5pYTEPMA0GA1UECgwGQ3JlYXRlMQwwCgYDVQQLDANSJkQxFTATBgNVBAMMDE5hdGlvblhDX1ROUDBZMBMGByqGSM49AgEGCCqGSM49AwEHA0IABGyu+Fiohg8APhNR8M0ES2qC0bMXLQb8QCoAakFJ0yubhJku+Q1hJE1uXIJo1JMMMSqhWkH6ZLaroQgCrXEfeXqjRTBDMBIGA1UdEwEB/wQIMAYBAf8CAQAwDgYDVR0PAQH/BAQDAgEGMB0GA1UdDgQWBBQ6ucEi0XUzbXD4njquKtEXAtxYnzAKBggqhkjOPQQDAgNHADBEAiAYInGL6MNXhsxaHULBN7qoGdZU0fCUcU/Ga015QzDH6gIged0zuy/RlSqRb8BGgMwmJ9m/8WT82FpG2obN/QxPMGI="],"crv":"P-256","x":"WAtDY2mYh1qi18aJHQNFDc5daPqdNLRqpSmHNdWMKLo","y":"A-kULLvX3qB_1bDLnrvMSvpVqzzSq0GocSA-4f2OWxI"},"domain":"PH4H","participant":"XL","keyusage":"DSC"}],"proof":{"type":"JsonWebSignature2020","created":"2026-01-04T06:00:26Z","nonce":"quBNC4BLGAiuULyynAPMhMt1O0pzIH1Y","proofPurpose":"assertionMethod","verificationMethod":"did:web:raw.githubusercontent.com:WorldHealthOrganization:tng-participants-dev:main:WHO:signing:DID","jws":"eyJiNjQiOmZhbHNlLCJjcml0IjpbImI2NCJdLCJhbGciOiJFUzI1NiJ9..MEQCIEe0i0KnlvG41pG8XVDUfo7-1nWPgCgKndj1Snn8hGPyAiApHO4bRW0CcuAtK7Q8LE5WuRt_HHIKBvRjvEfRhp59JQ"}}