{"@context":["https://www.w3.org/ns/did/v1","https://w3id.org/security/suites/jws-2020/v1","https://worldhealthorganization.github.io/smart-trust/tng-additional-context/v1"],"id":"did:web:tng-cdn-dev.who.int:v2:trustlist:PH4H:XG","controller":"did:web:tng-cdn-dev.who.int:v2:trustlist:PH4H","verificationMethod":[{"id":"did:web:tng-cdn-dev.who.int:v2:trustlist:PH4H:XG:SCA#VsqB8MP0/ho=","type":"JsonWebKey2020","controller":"did:web:tng-cdn-dev.who.int:v2:trustlist:PH4H","publicKeyJwk":{"kty":"EC","kid":"VsqB8MP0/ho=","x5c":["MIICEzCCAbmgAwIBAgIUMYEsHXBQn1MZ22ld5Xs1TR93GiQwCgYIKoZIzj0EAwIwZjELMAkGA1UEBhMCWEcxEzARBgNVBAgMClRlc3QgU3RhdGUxDzANBgNVBAcMBkdlbmV2YTEMMAoGA1UECgwDV0hPMQwwCgYDVQQLDANSJkQxFTATBgNVBAMMDE5hdGlvblhDX1ROUDAeFw0yNTA5MjUxMjU4MDdaFw0yOTA5MjUxMjU4MDdaMGYxCzAJBgNVBAYTAlhHMRMwEQYDVQQIDApUZXN0IFN0YXRlMQ8wDQYDVQQHDAZHZW5ldmExDDAKBgNVBAoMA1dITzEMMAoGA1UECwwDUiZEMRUwEwYDVQQDDAxOYXRpb25YQ19UTlAwWTATBgcqhkjOPQIBBggqhkjOPQMBBwNCAASXYPuWZvccoo4sD6YZqBz96uWHfO4f1BDmysfpKaSpDfbLclrUJZuWJ1vXdoqG6W2PIqJoMnVSld6NA14SzYTuo0UwQzASBgNVHRMBAf8ECDAGAQH/AgEAMA4GA1UdDwEB/wQEAwIBBjAdBgNVHQ4EFgQU/1pyYI7/Gk0EznIFqjiR0LyCGwYwCgYIKoZIzj0EAwIDSAAwRQIhANza+6XcacBLL3T459jcIIihdDXm7pD9vfqEu3hrUB1GAiB8Y4oCzO+A75qmY42PrvIMaOVyJOv/cqV21sqcKbTi3A=="],"crv":"P-256","x":"AJdg-5Zm9xyijiwPphmoHP3q5Yd87h_UEObKx-kppKkN","y":"APbLclrUJZuWJ1vXdoqG6W2PIqJoMnVSld6NA14SzYTu"},"domain":"PH4H","participant":"XG","keyusage":"SCA"}],"proof":{"type":"JsonWebSignature2020","created":"2026-01-04T06:00:14Z","nonce":"q7K1caYM7rEGDHnB2D9QFeTotcf4FMWQ","proofPurpose":"assertionMethod","verificationMethod":"did:web:raw.githubusercontent.com:WorldHealthOrganization:tng-participants-dev:main:WHO:signing:DID","jws":"eyJiNjQiOmZhbHNlLCJjcml0IjpbImI2NCJdLCJhbGciOiJFUzI1NiJ9..MEUCIBkORhWe6NxUcb6C4NwfN8VSpRJdM7JWkOoLbBdvXkr8AiEAgKAn6XL5IWWveclxpGyxZEn0Qf6tztTwblInTMQVnKE"}}